{
  "schema_version": "agent-orientation-catalog/s0",
  "catalog_id": "agent-orientation-catalog/s0",
  "slice_id": "agent-orientation-s0",
  "authority": "docs/AGENT-ORIENTATION-S0.md",
  "rfc": "rfcs/RFC-0106-agent-orientation.md",
  "new_verbs": [],
  "new_events": [],
  "arrival_speech": false,
  "invent_strain": false,
  "thesis_forbidden": true,
  "max_available_actions": 8
}
